{
  "report_kind": "copyofa.comparison",
  "format_version": 4,
  "copyofa_version": "0.8.0.dev0",
  "compared_at": "2026-10-27T02:27:19Z",
  "omitted": [],
  "inputs": {
    "a": {
      "evidence_set": "/Volumes/Archive/set-1",
      "integrity_baseline": {
        "manifest_sha256": "85d3d156f602055060e9171495f69a0a4235796bb48981d1c8bf633a1e15fb31",
        "usable": true,
        "problems": []
      },
      "path": "data/Album/a.flac",
      "outcome": "interpreted",
      "expected_digest": "da6fb7f0d64228b55977d8fffe5a8bbe82ae0ec5b663cae101b4a0d05fec6e2a",
      "observed_digest": "da6fb7f0d64228b55977d8fffe5a8bbe82ae0ec5b663cae101b4a0d05fec6e2a",
      "format": "flac",
      "encoding": "pcm_16",
      "sample_rate": 44100,
      "channels": 2,
      "bits_per_sample": 16,
      "frames": 44100,
      "audio_digest": "pcm1:44100:2:16:f1962b197b6911a1bc5cefafd26b6e3e640c3212d23fb254cb67877d865a3637",
      "peak": [
        32766,
        32768
      ],
      "leading_silence_frames": 0,
      "trailing_silence_frames": 0,
      "flac_md5_signature": "matching"
    },
    "b": {
      "evidence_set": "/Volumes/Archive/set-2",
      "integrity_baseline": {
        "manifest_sha256": "66ac3df8fe1e30a96ee771cc4af5e157b04a3b16611b9490ea24f66a406c4be3",
        "usable": true,
        "problems": []
      },
      "path": "data/Album/a.flac",
      "outcome": "interpreted",
      "expected_digest": "3d192fb2c1c3339f51d3939e5df7dd7a34eae3ee50c70f01b9970d2b130e08b1",
      "observed_digest": "3d192fb2c1c3339f51d3939e5df7dd7a34eae3ee50c70f01b9970d2b130e08b1",
      "format": "flac",
      "encoding": "pcm_16",
      "sample_rate": 44100,
      "channels": 2,
      "bits_per_sample": 16,
      "frames": 44100,
      "audio_digest": "pcm1:44100:2:16:6e5d658a9ff01918ea7a6db4974b3b447bf6b015822c16678dd3129a9e474c31",
      "peak": [
        32768,
        32766
      ],
      "leading_silence_frames": 0,
      "trailing_silence_frames": 0,
      "flac_md5_signature": "matching"
    }
  },
  "method": {
    "decoder": "libsndfile",
    "decoder_version": "1.2.2",
    "resampler": "libsoxr",
    "resampler_version": "0.1.3-14-ga66f3ee",
    "resampler_quality": "VHQ",
    "common_sample_rate": 44100,
    "alignment": "windowed_portions",
    "parameters": {
      "decimation_factor": 16,
      "decimation_quality": "HQ",
      "first_difference_coefficient": 0.5,
      "window_seconds": 5,
      "hop_seconds": 5,
      "silent_window_energy_ratio": 0.0001,
      "b_position_energy_floor": 1e-10,
      "candidate_threshold": 0.4,
      "candidates_per_window": 3,
      "candidate_separation_seconds": 0.5,
      "skipped_windows": 1,
      "chaining_tolerance_frames": 32,
      "core_ratio": 0.85,
      "core_seconds": 20,
      "refinement_radius_frames": 32,
      "block_frames": 2048,
      "matched_block_residual_ratio": 0.2,
      "core_confirming_ratio": 0.5,
      "evidence_floor_dbfs": -80,
      "silence_against_signal_dbfs": -60,
      "end_range_inside_blocks": 8,
      "end_range_outside_blocks": 1,
      "acceptance_residual_db": -10,
      "minimum_portion_seconds": 1,
      "merge_tolerance_frames": 2,
      "alternate_margin_db": 3,
      "alternate_coverage_ratio": 0.9,
      "equal_residual_floor_db": -60
    }
  },
  "measurements": {
    "portions": [],
    "unmatched": {
      "a": [
        {
          "start_frame": 0,
          "frames": 44100,
          "digitally_silent": false,
          "level_dbfs": -4.769955613542516
        }
      ],
      "b": [
        {
          "start_frame": 0,
          "frames": 44100,
          "digitally_silent": false,
          "level_dbfs": -4.757781105578381
        }
      ]
    },
    "absent": {
      "portions": "track A is shorter than one window of 5 s"
    }
  },
  "limitations": [
    "No measurement says whether the tracks share a master, a mix or a source; the Report draws no such conclusion.",
    "MP3 is lossy: the measurements of an MP3 depend on its decoder.",
    "Tracks at different sample rates are compared at the lower rate, after resampling, so differences above that rate's band are not measured.",
    "Portions shorter than about 2.5 s may be missed, and the search finds no portion in a track shorter than 5 s; identical audio still gets its portion.",
    "Speed, pitch and drift differences give no portion.",
    "A boundary inside audio below -80 dBFS is placed at the nearest frame with evidence, and the rest is reported as unmatched.",
    "A boundary at a fade falls about three blocks of 2048 frames inside it, where the gain fitted over the eight blocks inside the edge stops fitting the faded audio, not where the fade gets quiet; a boundary at a crossfade falls where the other audio refutes the match.",
    "In music that repeats a section, one range of a track can match several places in the other; each is reported as a portion.",
    "Channels are paired in the order each file stores them."
  ]
}
